{
  "manifest_version": "1",
  "name": "clap-model-cache-smoke",
  "repetitions": 2,
  "seed": 1729,
  "audio": [
    { "id": "guitar", "path": "/path/to/guitar.wav" }
  ],
  "prompts": [
    { "id": "warm", "text": "warm and lightly saturated" }
  ],
  "matrix": {
    "backend": ["clap"],
    "model": ["ms_clap"],
    "criterion": ["cosine-sim"],
    "iterations": [1],
    "learning_rate": [0.01],
    "parameter_initialization": ["current"]
  }
}
